{
	"$schema": "common-schema.json#/schema",
	"productIdentifier": "sfasdf",
	"productName": "sadfsdfa",
	"manufacturer": {
	    "coName": "sdadsfas",
	    "webHomePageURL": "www.evonet.com"
	},
	"typeSpecificParameters": {
	   "fuse":{
	       "breakingCapacity": "1kA",
	       "currentRating": {
	           "value": 10,
	           "units": "A"
	       }
	   },
	   "solar": {
	       "openCircuitVolts": {
	           "value": 80,
	           "units": "V"
	       },
	       "panelType": "flexible"
	   }
	   
	   
    },
    "embargoedCountries": ["UK","US"]
    
	
	
	
	
}